<?xml version="1.0" encoding="UTF-8"?>
<xs:schema xmlns:xs="http://www.w3.org/2001/XMLSchema">
	<xs:element name="list">
		<xs:complexType>
			<xs:sequence>
				<xs:element name="spawn" maxOccurs="unbounded">
					<xs:complexType>
						<xs:sequence maxOccurs="unbounded">
							<xs:element name="AIData" minOccurs="0">
								<xs:complexType>
									<xs:sequence>
										<xs:element type="xs:nonNegativeInteger" name="aggroRange" minOccurs="0" />
										<xs:element type="xs:boolean" name="disableRandomAnimation" minOccurs="0" />
										<xs:element type="xs:boolean" name="disableRandomWalk" minOccurs="0" />
										<xs:element type="xs:integer" name="fleeX" minOccurs="0" />
										<xs:element type="xs:integer" name="fleeY" minOccurs="0" />
										<xs:element type="xs:integer" name="fleeZ" minOccurs="0" />
									</xs:sequence>
								</xs:complexType>
							</xs:element>
							<xs:element name="npc" maxOccurs="unbounded">
								<xs:complexType>
									<xs:simpleContent>
										<xs:extension base="xs:string">
											<xs:attribute name="id" type="xs:positiveInteger" use="required" />
											<xs:attribute name="x" type="xs:integer" />
											<xs:attribute name="y" type="xs:integer" />
											<xs:attribute name="z" type="xs:integer" />
											<xs:attribute name="heading" type="xs:integer" />
											<xs:attribute name="count" type="xs:positiveInteger" />
											<xs:attribute name="respawnDelay" type="xs:nonNegativeInteger" />
											<xs:attribute name="respawnRandom" type="xs:nonNegativeInteger" />
											<xs:attribute name="periodOfDay">
												<xs:simpleType>
													<xs:restriction base="xs:token">
														<xs:enumeration value="day" />
														<xs:enumeration value="night" />
													</xs:restriction>
												</xs:simpleType>
											</xs:attribute>
										</xs:extension>
									</xs:simpleContent>
								</xs:complexType>
							</xs:element>
						</xs:sequence>
						<xs:attribute type="xs:string" name="name" />
						<xs:attribute type="xs:string" name="zone" />
						<xs:attribute type="xs:boolean" name="enabled" />
					</xs:complexType>
				</xs:element>
			</xs:sequence>
			<xs:attribute name="enabled" type="xs:boolean" use="required" />
	</xs:complexType>
	</xs:element>
</xs:schema>